Title,Link,Difficulty,Topic
"Create a Session Bar Chart","https://leetcode.com/problems/create-a-session-bar-chart","EASY","Database"
"Design a File Sharing System","https://leetcode.com/problems/design-a-file-sharing-system","MEDIUM","Hash Table, Design, Sorting, Heap (Priority Queue), Data Stream"
"Toss Strange Coins","https://leetcode.com/problems/toss-strange-coins","MEDIUM","Array, Math, Dynamic Programming, Probability and Statistics"
"LRU Cache","https://leetcode.com/problems/lru-cache","MEDIUM","Hash Table, Linked List, Design, Doubly-Linked List"
"Reverse Vowels of a String","https://leetcode.com/problems/reverse-vowels-of-a-string","EASY","Two Pointers, String"
"Letter Combinations of a Phone Number","https://leetcode.com/problems/letter-combinations-of-a-phone-number","MEDIUM","Hash Table, String, Backtracking"
"Unique Email Addresses","https://leetcode.com/problems/unique-email-addresses","EASY","Array, Hash Table, String"
"Find Median from Data Stream","https://leetcode.com/problems/find-median-from-data-stream","HARD","Two Pointers, Design, Sorting, Heap (Priority Queue), Data Stream"
