Title,Link,Difficulty,Topic
"Bulb Switcher","https://leetcode.com/problems/bulb-switcher","MEDIUM","Math, Brainteaser"
"Happy Number","https://leetcode.com/problems/happy-number","EASY","Hash Table, Math, Two Pointers"
"Two Sum","https://leetcode.com/problems/two-sum","EASY","Array, Hash Table"
"Climbing Stairs","https://leetcode.com/problems/climbing-stairs","EASY","Math, Dynamic Programming, Memoization"
"Best Time to Buy and Sell Stock","https://leetcode.com/problems/best-time-to-buy-and-sell-stock","EASY","Array, Dynamic Programming"
"Palindrome Number","https://leetcode.com/problems/palindrome-number","EASY","Math"
"Rotate Array","https://leetcode.com/problems/rotate-array","MEDIUM","Array, Math, Two Pointers"
"Roman to Integer","https://leetcode.com/problems/roman-to-integer","EASY","Hash Table, Math, String"
"Maximum Subarray","https://leetcode.com/problems/maximum-subarray","MEDIUM","Array, Divide and Conquer, Dynamic Programming"
"Delete and Earn","https://leetcode.com/problems/delete-and-earn","MEDIUM","Array, Hash Table, Dynamic Programming"
"Sum of Values at Indices With K Set Bits","https://leetcode.com/problems/sum-of-values-at-indices-with-k-set-bits","EASY","Array, Bit Manipulation"
"Find Subsequence of Length K With the Largest Sum","https://leetcode.com/problems/find-subsequence-of-length-k-with-the-largest-sum","EASY","Array, Hash Table, Sorting, Heap (Priority Queue)"
"Maximum Area of Longest Diagonal Rectangle","https://leetcode.com/problems/maximum-area-of-longest-diagonal-rectangle","EASY","Array"
"Ant on the Boundary","https://leetcode.com/problems/ant-on-the-boundary","EASY","Array, Simulation, Prefix Sum"
"Count Tested Devices After Test Operations","https://leetcode.com/problems/count-tested-devices-after-test-operations","EASY","Array, Simulation, Counting"
"Permutation Difference between Two Strings","https://leetcode.com/problems/permutation-difference-between-two-strings","EASY","Hash Table, String"
"Minimum Right Shifts to Sort the Array","https://leetcode.com/problems/minimum-right-shifts-to-sort-the-array","EASY","Array"
"Reverse Integer","https://leetcode.com/problems/reverse-integer","MEDIUM","Math"
"Longest Palindromic Substring","https://leetcode.com/problems/longest-palindromic-substring","MEDIUM","Two Pointers, String, Dynamic Programming"
"Largest Number","https://leetcode.com/problems/largest-number","MEDIUM","Array, String, Greedy, Sorting"
"Merge Sorted Array","https://leetcode.com/problems/merge-sorted-array","EASY","Array, Two Pointers, Sorting"
"Longest Common Prefix","https://leetcode.com/problems/longest-common-prefix","EASY","String, Trie"
"Spiral Matrix","https://leetcode.com/problems/spiral-matrix","MEDIUM","Array, Matrix, Simulation"
"Shortest Palindrome","https://leetcode.com/problems/shortest-palindrome","HARD","String, Rolling Hash, String Matching, Hash Function"
"Sort Integers by The Number of 1 Bits","https://leetcode.com/problems/sort-integers-by-the-number-of-1-bits","EASY","Array, Bit Manipulation, Sorting, Counting"
"Majority Element","https://leetcode.com/problems/majority-element","EASY","Array, Hash Table, Divide and Conquer, Sorting, Counting"
"Longest Substring Without Repeating Characters","https://leetcode.com/problems/longest-substring-without-repeating-characters","MEDIUM","Hash Table, String, Sliding Window"
"3Sum","https://leetcode.com/problems/3sum","MEDIUM","Array, Two Pointers, Sorting"
"Find Peak Element","https://leetcode.com/problems/find-peak-element","MEDIUM","Array, Binary Search"
"Reverse Words in a String","https://leetcode.com/problems/reverse-words-in-a-string","MEDIUM","Two Pointers, String"
"Perfect Squares","https://leetcode.com/problems/perfect-squares","MEDIUM","Math, Dynamic Programming, Breadth-First Search"
"Integer Break","https://leetcode.com/problems/integer-break","MEDIUM","Math, Dynamic Programming"
"Valid Anagram","https://leetcode.com/problems/valid-anagram","EASY","Hash Table, String, Sorting"
"Valid Parentheses","https://leetcode.com/problems/valid-parentheses","EASY","String, Stack"
"Plus One","https://leetcode.com/problems/plus-one","EASY","Array, Math"
"Product of Array Except Self","https://leetcode.com/problems/product-of-array-except-self","MEDIUM","Array, Prefix Sum"
"Container With Most Water","https://leetcode.com/problems/container-with-most-water","MEDIUM","Array, Two Pointers, Greedy"
"Fibonacci Number","https://leetcode.com/problems/fibonacci-number","EASY","Math, Dynamic Programming, Recursion, Memoization"
"Remove Duplicates from Sorted Array","https://leetcode.com/problems/remove-duplicates-from-sorted-array","EASY","Array, Two Pointers"
"Add Two Numbers","https://leetcode.com/problems/add-two-numbers","MEDIUM","Linked List, Math, Recursion"
"Assign Cookies","https://leetcode.com/problems/assign-cookies","EASY","Array, Two Pointers, Greedy, Sorting"
"House Robber","https://leetcode.com/problems/house-robber","MEDIUM","Array, Dynamic Programming"
"Reverse Vowels of a String","https://leetcode.com/problems/reverse-vowels-of-a-string","EASY","Two Pointers, String"
"Find First and Last Position of Element in Sorted Array","https://leetcode.com/problems/find-first-and-last-position-of-element-in-sorted-array","MEDIUM","Array, Binary Search"
"Longest Increasing Subsequence","https://leetcode.com/problems/longest-increasing-subsequence","MEDIUM","Array, Binary Search, Dynamic Programming"
"Coin Change","https://leetcode.com/problems/coin-change","MEDIUM","Array, Dynamic Programming, Breadth-First Search"
"Nth Digit","https://leetcode.com/problems/nth-digit","MEDIUM","Math, Binary Search"
"Candy","https://leetcode.com/problems/candy","HARD","Array, Greedy"
"Count Primes","https://leetcode.com/problems/count-primes","MEDIUM","Array, Math, Enumeration, Number Theory"
"Merge Intervals","https://leetcode.com/problems/merge-intervals","MEDIUM","Array, Sorting"
"Koko Eating Bananas","https://leetcode.com/problems/koko-eating-bananas","MEDIUM","Array, Binary Search"
"Pascal's Triangle","https://leetcode.com/problems/pascals-triangle","EASY","Array, Dynamic Programming"
"Rotate Image","https://leetcode.com/problems/rotate-image","MEDIUM","Array, Math, Matrix"
"Perfect Number","https://leetcode.com/problems/perfect-number","EASY","Math"
"Sort Array by Increasing Frequency","https://leetcode.com/problems/sort-array-by-increasing-frequency","EASY","Array, Hash Table, Sorting"
"Find the Winner of the Circular Game","https://leetcode.com/problems/find-the-winner-of-the-circular-game","MEDIUM","Array, Math, Recursion, Queue, Simulation"
"Next Greater Element I","https://leetcode.com/problems/next-greater-element-i","EASY","Array, Hash Table, Stack, Monotonic Stack"
"Valid Palindrome","https://leetcode.com/problems/valid-palindrome","EASY","Two Pointers, String"
"Edit Distance","https://leetcode.com/problems/edit-distance","MEDIUM","String, Dynamic Programming"
"Next Permutation","https://leetcode.com/problems/next-permutation","MEDIUM","Array, Two Pointers"
"Reverse Linked List","https://leetcode.com/problems/reverse-linked-list","EASY","Linked List, Recursion"
"Remove Element","https://leetcode.com/problems/remove-element","EASY","Array, Two Pointers"
"Remove Duplicates from Sorted List","https://leetcode.com/problems/remove-duplicates-from-sorted-list","EASY","Linked List"
"Is Subsequence","https://leetcode.com/problems/is-subsequence","EASY","Two Pointers, String, Dynamic Programming"
"Find the Index of the First Occurrence in a String","https://leetcode.com/problems/find-the-index-of-the-first-occurrence-in-a-string","EASY","Two Pointers, String, String Matching"
"Peak Index in a Mountain Array","https://leetcode.com/problems/peak-index-in-a-mountain-array","MEDIUM","Array, Binary Search"
"Max Consecutive Ones","https://leetcode.com/problems/max-consecutive-ones","EASY","Array"
"Unique Paths","https://leetcode.com/problems/unique-paths","MEDIUM","Math, Dynamic Programming, Combinatorics"
"Contains Duplicate","https://leetcode.com/problems/contains-duplicate","EASY","Array, Hash Table, Sorting"
"Majority Element II","https://leetcode.com/problems/majority-element-ii","MEDIUM","Array, Hash Table, Sorting, Counting"
"01 Matrix","https://leetcode.com/problems/01-matrix","MEDIUM","Array, Dynamic Programming, Breadth-First Search, Matrix"
"Average Value of Even Numbers That Are Divisible by Three","https://leetcode.com/problems/average-value-of-even-numbers-that-are-divisible-by-three","EASY","Array, Math"
"Integer to Roman","https://leetcode.com/problems/integer-to-roman","MEDIUM","Hash Table, Math, String"
"Single Number II","https://leetcode.com/problems/single-number-ii","MEDIUM","Array, Bit Manipulation"
"Daily Temperatures","https://leetcode.com/problems/daily-temperatures","MEDIUM","Array, Stack, Monotonic Stack"
"Search a 2D Matrix","https://leetcode.com/problems/search-a-2d-matrix","MEDIUM","Array, Binary Search, Matrix"
"Count Pairs Whose Sum is Less than Target","https://leetcode.com/problems/count-pairs-whose-sum-is-less-than-target","EASY","Array, Two Pointers, Binary Search, Sorting"
"Kth Largest Element in an Array","https://leetcode.com/problems/kth-largest-element-in-an-array","MEDIUM","Array, Divide and Conquer, Sorting, Heap (Priority Queue), Quickselect"
"Substrings of Size Three with Distinct Characters","https://leetcode.com/problems/substrings-of-size-three-with-distinct-characters","EASY","Hash Table, String, Sliding Window, Counting"
"Count Operations to Obtain Zero","https://leetcode.com/problems/count-operations-to-obtain-zero","EASY","Math, Simulation"
"Number of Days Between Two Dates","https://leetcode.com/problems/number-of-days-between-two-dates","EASY","Math, String"
"Maximum Depth of Binary Tree","https://leetcode.com/problems/maximum-depth-of-binary-tree","EASY","Tree, Depth-First Search, Breadth-First Search, Binary Tree"
"Excel Sheet Column Title","https://leetcode.com/problems/excel-sheet-column-title","EASY","Math, String"
"Second Highest Salary","https://leetcode.com/problems/second-highest-salary","MEDIUM","Database"
"Sqrt(x)","https://leetcode.com/problems/sqrtx","EASY","Math, Binary Search"
"Find Original Array From Doubled Array","https://leetcode.com/problems/find-original-array-from-doubled-array","MEDIUM","Array, Hash Table, Greedy, Sorting"
"N-th Tribonacci Number","https://leetcode.com/problems/n-th-tribonacci-number","EASY","Math, Dynamic Programming, Memoization"
"Basic Calculator II","https://leetcode.com/problems/basic-calculator-ii","MEDIUM","Math, String, Stack"
"Pow(x, n)","https://leetcode.com/problems/powx-n","MEDIUM","Math, Recursion"
"Ugly Number II","https://leetcode.com/problems/ugly-number-ii","MEDIUM","Hash Table, Math, Dynamic Programming, Heap (Priority Queue)"
"Intersection of Two Linked Lists","https://leetcode.com/problems/intersection-of-two-linked-lists","EASY","Hash Table, Linked List, Two Pointers"
"Group Anagrams","https://leetcode.com/problems/group-anagrams","MEDIUM","Array, Hash Table, String, Sorting"
"How Many Numbers Are Smaller Than the Current Number","https://leetcode.com/problems/how-many-numbers-are-smaller-than-the-current-number","EASY","Array, Hash Table, Sorting, Counting Sort"
"Palindromic Substrings","https://leetcode.com/problems/palindromic-substrings","MEDIUM","Two Pointers, String, Dynamic Programming"
"Min Cost Climbing Stairs","https://leetcode.com/problems/min-cost-climbing-stairs","EASY","Array, Dynamic Programming"
"Truncate Sentence","https://leetcode.com/problems/truncate-sentence","EASY","Array, String"
"Median of Two Sorted Arrays","https://leetcode.com/problems/median-of-two-sorted-arrays","HARD","Array, Binary Search, Divide and Conquer"
"Binary Search","https://leetcode.com/problems/binary-search","EASY","Array, Binary Search"
"Make The String Great","https://leetcode.com/problems/make-the-string-great","EASY","String, Stack"
"Department Top Three Salaries","https://leetcode.com/problems/department-top-three-salaries","HARD","Database"
