Title,Link,Difficulty,Topic
"Split Array with Equal Sum","https://leetcode.com/problems/split-array-with-equal-sum","HARD","Array, Hash Table, Prefix Sum"
"Split Concatenated Strings","https://leetcode.com/problems/split-concatenated-strings","MEDIUM","Array, String, Greedy"
"Path Sum IV","https://leetcode.com/problems/path-sum-iv","MEDIUM","Array, Hash Table, Tree, Depth-First Search, Binary Tree"
"Valid Parenthesis String","https://leetcode.com/problems/valid-parenthesis-string","MEDIUM","String, Dynamic Programming, Stack, Greedy"
"Longest Substring Without Repeating Characters","https://leetcode.com/problems/longest-substring-without-repeating-characters","MEDIUM","Hash Table, String, Sliding Window"
