Title,Link,Difficulty,Topic
"4Sum","https://leetcode.com/problems/4sum","MEDIUM","Array, Two Pointers, Sorting"
"Furthest Building You Can Reach","https://leetcode.com/problems/furthest-building-you-can-reach","MEDIUM","Array, Greedy, Heap (Priority Queue)"
"Container With Most Water","https://leetcode.com/problems/container-with-most-water","MEDIUM","Array, Two Pointers, Greedy"
"Largest Rectangle in Histogram","https://leetcode.com/problems/largest-rectangle-in-histogram","HARD","Array, Stack, Monotonic Stack"
"Maximum Profit in Job Scheduling","https://leetcode.com/problems/maximum-profit-in-job-scheduling","HARD","Array, Binary Search, Dynamic Programming, Sorting"
"Sliding Window Maximum","https://leetcode.com/problems/sliding-window-maximum","HARD","Array, Queue, Sliding Window, Heap (Priority Queue), Monotonic Queue"
"Koko Eating Bananas","https://leetcode.com/problems/koko-eating-bananas","MEDIUM","Array, Binary Search"
"Copy List with Random Pointer","https://leetcode.com/problems/copy-list-with-random-pointer","MEDIUM","Hash Table, Linked List"
"House Robber III","https://leetcode.com/problems/house-robber-iii","MEDIUM","Dynamic Programming, Tree, Depth-First Search, Binary Tree"
