Title,Link,Difficulty,Topic
"Frog Jump","https://leetcode.com/problems/frog-jump","HARD","Array, Dynamic Programming"
"Burst Balloons","https://leetcode.com/problems/burst-balloons","HARD","Array, Dynamic Programming"
"Decoded String at Index","https://leetcode.com/problems/decoded-string-at-index","MEDIUM","String, Stack"
"Maximum Tastiness of Candy Basket","https://leetcode.com/problems/maximum-tastiness-of-candy-basket","MEDIUM","Array, Binary Search, Greedy, Sorting"
"Simple Bank System","https://leetcode.com/problems/simple-bank-system","MEDIUM","Array, Hash Table, Design, Simulation"
"Smallest Range Covering Elements from K Lists","https://leetcode.com/problems/smallest-range-covering-elements-from-k-lists","HARD","Array, Hash Table, Greedy, Sliding Window, Sorting, Heap (Priority Queue)"
"Viewers Turned Streamers","https://leetcode.com/problems/viewers-turned-streamers","HARD","Database"
"Frequencies of Shortest Supersequences","https://leetcode.com/problems/frequencies-of-shortest-supersequences","HARD","Array, String, Bit Manipulation, Graph, Topological Sort, Enumeration"
"Smallest String With Swaps","https://leetcode.com/problems/smallest-string-with-swaps","MEDIUM","Array, Hash Table, String, Depth-First Search, Breadth-First Search, Union Find, Sorting"
"Maximum Amount of Money Robot Can Earn","https://leetcode.com/problems/maximum-amount-of-money-robot-can-earn","MEDIUM","Array, Dynamic Programming, Matrix"
"Check if Point Is Reachable","https://leetcode.com/problems/check-if-point-is-reachable","HARD","Math, Number Theory"
"Count the Number of Arrays with K Matching Adjacent Elements","https://leetcode.com/problems/count-the-number-of-arrays-with-k-matching-adjacent-elements","HARD","Math, Combinatorics"
"Find Beautiful Indices in the Given Array II","https://leetcode.com/problems/find-beautiful-indices-in-the-given-array-ii","HARD","Two Pointers, String, Binary Search, Rolling Hash, String Matching, Hash Function"
"Remove K Digits","https://leetcode.com/problems/remove-k-digits","MEDIUM","String, Stack, Greedy, Monotonic Stack"
"Most Stones Removed with Same Row or Column","https://leetcode.com/problems/most-stones-removed-with-same-row-or-column","MEDIUM","Hash Table, Depth-First Search, Union Find, Graph"
"Bus Routes","https://leetcode.com/problems/bus-routes","HARD","Array, Hash Table, Breadth-First Search"
"Trapping Rain Water","https://leetcode.com/problems/trapping-rain-water","HARD","Array, Two Pointers, Dynamic Programming, Stack, Monotonic Stack"
"Longest Palindromic Substring","https://leetcode.com/problems/longest-palindromic-substring","MEDIUM","Two Pointers, String, Dynamic Programming"
"House Robber II","https://leetcode.com/problems/house-robber-ii","MEDIUM","Array, Dynamic Programming"
"Queue Reconstruction by Height","https://leetcode.com/problems/queue-reconstruction-by-height","MEDIUM","Array, Binary Indexed Tree, Segment Tree, Sorting"
"Split Array Largest Sum","https://leetcode.com/problems/split-array-largest-sum","HARD","Array, Binary Search, Dynamic Programming, Greedy, Prefix Sum"
"Candy","https://leetcode.com/problems/candy","HARD","Array, Greedy"
"Frequency of the Most Frequent Element","https://leetcode.com/problems/frequency-of-the-most-frequent-element","MEDIUM","Array, Binary Search, Greedy, Sliding Window, Sorting, Prefix Sum"
"House Robber","https://leetcode.com/problems/house-robber","MEDIUM","Array, Dynamic Programming"
"Best Time to Buy and Sell Stock","https://leetcode.com/problems/best-time-to-buy-and-sell-stock","EASY","Array, Dynamic Programming"
"Kth Smallest Element in a Sorted Matrix","https://leetcode.com/problems/kth-smallest-element-in-a-sorted-matrix","MEDIUM","Array, Binary Search, Sorting, Heap (Priority Queue), Matrix"
"Maximum Profit in Job Scheduling","https://leetcode.com/problems/maximum-profit-in-job-scheduling","HARD","Array, Binary Search, Dynamic Programming, Sorting"
"Amount of Time for Binary Tree to Be Infected","https://leetcode.com/problems/amount-of-time-for-binary-tree-to-be-infected","MEDIUM","Hash Table, Tree, Depth-First Search, Breadth-First Search, Binary Tree"
"Longest Continuous Subarray With Absolute Diff Less Than or Equal to Limit","https://leetcode.com/problems/longest-continuous-subarray-with-absolute-diff-less-than-or-equal-to-limit","MEDIUM","Array, Queue, Sliding Window, Heap (Priority Queue), Ordered Set, Monotonic Queue"
"Reachable Nodes In Subdivided Graph","https://leetcode.com/problems/reachable-nodes-in-subdivided-graph","HARD","Graph, Heap (Priority Queue), Shortest Path"
"Koko Eating Bananas","https://leetcode.com/problems/koko-eating-bananas","MEDIUM","Array, Binary Search"
"Sum of Distances in Tree","https://leetcode.com/problems/sum-of-distances-in-tree","HARD","Dynamic Programming, Tree, Depth-First Search, Graph"
"Make Lexicographically Smallest Array by Swapping Elements","https://leetcode.com/problems/make-lexicographically-smallest-array-by-swapping-elements","MEDIUM","Array, Union Find, Sorting"
"IPO","https://leetcode.com/problems/ipo","HARD","Array, Greedy, Sorting, Heap (Priority Queue)"
"Jump Game II","https://leetcode.com/problems/jump-game-ii","MEDIUM","Array, Dynamic Programming, Greedy"
"House Robber III","https://leetcode.com/problems/house-robber-iii","MEDIUM","Dynamic Programming, Tree, Depth-First Search, Binary Tree"
"Distribute Coins in Binary Tree","https://leetcode.com/problems/distribute-coins-in-binary-tree","MEDIUM","Tree, Depth-First Search, Binary Tree"
"Sort Colors","https://leetcode.com/problems/sort-colors","MEDIUM","Array, Two Pointers, Sorting"
"Merge Intervals","https://leetcode.com/problems/merge-intervals","MEDIUM","Array, Sorting"
"Maximal Square","https://leetcode.com/problems/maximal-square","MEDIUM","Array, Dynamic Programming, Matrix"
"Split Array into Consecutive Subsequences","https://leetcode.com/problems/split-array-into-consecutive-subsequences","MEDIUM","Array, Hash Table, Greedy, Heap (Priority Queue)"
"Best Time to Buy and Sell Stock III","https://leetcode.com/problems/best-time-to-buy-and-sell-stock-iii","HARD","Array, Dynamic Programming"
"Word Ladder","https://leetcode.com/problems/word-ladder","HARD","Hash Table, String, Breadth-First Search"
"Minimum Cost to Cut a Stick","https://leetcode.com/problems/minimum-cost-to-cut-a-stick","HARD","Array, Dynamic Programming, Sorting"
"Rotting Oranges","https://leetcode.com/problems/rotting-oranges","MEDIUM","Array, Breadth-First Search, Matrix"
"Matchsticks to Square","https://leetcode.com/problems/matchsticks-to-square","MEDIUM","Array, Dynamic Programming, Backtracking, Bit Manipulation, Bitmask"
"Sliding Window Maximum","https://leetcode.com/problems/sliding-window-maximum","HARD","Array, Queue, Sliding Window, Heap (Priority Queue), Monotonic Queue"
"Accounts Merge","https://leetcode.com/problems/accounts-merge","MEDIUM","Array, Hash Table, String, Depth-First Search, Breadth-First Search, Union Find, Sorting"
"Swim in Rising Water","https://leetcode.com/problems/swim-in-rising-water","HARD","Array, Binary Search, Depth-First Search, Breadth-First Search, Union Find, Heap (Priority Queue), Matrix"
"Best Time to Buy and Sell Stock IV","https://leetcode.com/problems/best-time-to-buy-and-sell-stock-iv","HARD","Array, Dynamic Programming"
"Evaluate Division","https://leetcode.com/problems/evaluate-division","MEDIUM","Array, String, Depth-First Search, Breadth-First Search, Union Find, Graph, Shortest Path"
"Binary Tree Level Order Traversal","https://leetcode.com/problems/binary-tree-level-order-traversal","MEDIUM","Tree, Breadth-First Search, Binary Tree"
"Group Anagrams","https://leetcode.com/problems/group-anagrams","MEDIUM","Array, Hash Table, String, Sorting"
"Longest Consecutive Sequence","https://leetcode.com/problems/longest-consecutive-sequence","MEDIUM","Array, Hash Table, Union Find"
"LRU Cache","https://leetcode.com/problems/lru-cache","MEDIUM","Hash Table, Linked List, Design, Doubly-Linked List"
"Find Duplicate Subtrees","https://leetcode.com/problems/find-duplicate-subtrees","MEDIUM","Hash Table, Tree, Depth-First Search, Binary Tree"
"Ways to Make a Fair Array","https://leetcode.com/problems/ways-to-make-a-fair-array","MEDIUM","Array, Prefix Sum"
"First Missing Positive","https://leetcode.com/problems/first-missing-positive","HARD","Array, Hash Table"
"Heaters","https://leetcode.com/problems/heaters","MEDIUM","Array, Two Pointers, Binary Search, Sorting"
"Snakes and Ladders","https://leetcode.com/problems/snakes-and-ladders","MEDIUM","Array, Breadth-First Search, Matrix"
"Sum of Subarray Minimums","https://leetcode.com/problems/sum-of-subarray-minimums","MEDIUM","Array, Dynamic Programming, Stack, Monotonic Stack"
"Asteroid Collision","https://leetcode.com/problems/asteroid-collision","MEDIUM","Array, Stack, Simulation"
"Generate Parentheses","https://leetcode.com/problems/generate-parentheses","MEDIUM","String, Dynamic Programming, Backtracking"
"Insert Interval","https://leetcode.com/problems/insert-interval","MEDIUM","Array"
"Binary Tree Cameras","https://leetcode.com/problems/binary-tree-cameras","HARD","Dynamic Programming, Tree, Depth-First Search, Binary Tree"
"Maximum Performance of a Team","https://leetcode.com/problems/maximum-performance-of-a-team","HARD","Array, Greedy, Sorting, Heap (Priority Queue)"
"Jump Game","https://leetcode.com/problems/jump-game","MEDIUM","Array, Dynamic Programming, Greedy"
"Partition Array Into Two Arrays to Minimize Sum Difference","https://leetcode.com/problems/partition-array-into-two-arrays-to-minimize-sum-difference","HARD","Array, Two Pointers, Binary Search, Dynamic Programming, Bit Manipulation, Ordered Set, Bitmask"
"Largest Rectangle in Histogram","https://leetcode.com/problems/largest-rectangle-in-histogram","HARD","Array, Stack, Monotonic Stack"
"Decode Ways II","https://leetcode.com/problems/decode-ways-ii","HARD","String, Dynamic Programming"
"Find Minimum Time to Finish All Jobs","https://leetcode.com/problems/find-minimum-time-to-finish-all-jobs","HARD","Array, Dynamic Programming, Backtracking, Bit Manipulation, Bitmask"
"Alien Dictionary","https://leetcode.com/problems/alien-dictionary","HARD","Array, String, Depth-First Search, Breadth-First Search, Graph, Topological Sort"
"Daily Temperatures","https://leetcode.com/problems/daily-temperatures","MEDIUM","Array, Stack, Monotonic Stack"
"Course Schedule II","https://leetcode.com/problems/course-schedule-ii","MEDIUM","Depth-First Search, Breadth-First Search, Graph, Topological Sort"
"Longest Repeating Character Replacement","https://leetcode.com/problems/longest-repeating-character-replacement","MEDIUM","Hash Table, String, Sliding Window"
"Complete Binary Tree Inserter","https://leetcode.com/problems/complete-binary-tree-inserter","MEDIUM","Tree, Breadth-First Search, Design, Binary Tree"
"String Compression","https://leetcode.com/problems/string-compression","MEDIUM","Two Pointers, String"
"Number of Islands","https://leetcode.com/problems/number-of-islands","MEDIUM","Array, Depth-First Search, Breadth-First Search, Union Find, Matrix"
"Magnetic Force Between Two Balls","https://leetcode.com/problems/magnetic-force-between-two-balls","MEDIUM","Array, Binary Search, Sorting"
"Number of Islands II","https://leetcode.com/problems/number-of-islands-ii","HARD","Array, Hash Table, Union Find"
"Copy List with Random Pointer","https://leetcode.com/problems/copy-list-with-random-pointer","MEDIUM","Hash Table, Linked List"
"Maximum Total Damage With Spell Casting","https://leetcode.com/problems/maximum-total-damage-with-spell-casting","MEDIUM","Array, Hash Table, Two Pointers, Binary Search, Dynamic Programming, Sorting, Counting"
"Find All Possible Recipes from Given Supplies","https://leetcode.com/problems/find-all-possible-recipes-from-given-supplies","MEDIUM","Array, Hash Table, String, Graph, Topological Sort"
"Gas Station","https://leetcode.com/problems/gas-station","MEDIUM","Array, Greedy"
"Walking Robot Simulation","https://leetcode.com/problems/walking-robot-simulation","MEDIUM","Array, Hash Table, Simulation"
"Minimum Cost Tree From Leaf Values","https://leetcode.com/problems/minimum-cost-tree-from-leaf-values","MEDIUM","Array, Dynamic Programming, Stack, Greedy, Monotonic Stack"
"Best Time to Buy and Sell Stock II","https://leetcode.com/problems/best-time-to-buy-and-sell-stock-ii","MEDIUM","Array, Dynamic Programming, Greedy"
"Apply Operations to Maximize Frequency Score","https://leetcode.com/problems/apply-operations-to-maximize-frequency-score","HARD","Array, Binary Search, Sliding Window, Sorting, Prefix Sum"
"Make Sum Divisible by P","https://leetcode.com/problems/make-sum-divisible-by-p","MEDIUM","Array, Hash Table, Prefix Sum"
"Minimum Height Trees","https://leetcode.com/problems/minimum-height-trees","MEDIUM","Depth-First Search, Breadth-First Search, Graph, Topological Sort"
"Find the Celebrity","https://leetcode.com/problems/find-the-celebrity","MEDIUM","Two Pointers, Graph, Interactive"
"Longest Common Prefix","https://leetcode.com/problems/longest-common-prefix","EASY","String, Trie"
"Number of Flowers in Full Bloom","https://leetcode.com/problems/number-of-flowers-in-full-bloom","HARD","Array, Hash Table, Binary Search, Sorting, Prefix Sum, Ordered Set"
